title,url,thumbnail_url,channel,views,uploaded_time,scraped_time,description
Lay Bankz - Na Na Na (Official Lyric Video),https://www.youtube.com/watch?v=Azl9KV_iT_U,https://i.ytimg.com/vi/Azl9KV_iT_U/hqdefault.jpg?sqp=-oaymwE2CPYBEIoBSFfyq4qpAygIARUAAIhCGAFwAcABBvABAfgB_gmAAtAFigIMCAAQARh_IC0oTDAP&rs=AOn4CLDSRq-6_w0G9W4YyiyauEyVtRdYxg,Lay Bankz 🤍,155K,11 days ago,14/06/2023,Lay Bankz - Na Na Na (Official Lyric Video) Listen/Download: https://laybankz.lnk.to/na.na.na Subscribe for more official content from Lay Bankz: https://laybankz.lnk.to/subscribe Follow...
Melanie Martinez - VOID (Official Music Video),https://www.youtube.com/watch?v=fzAyZ1Lh-zI,https://i.ytimg.com/vi/fzAyZ1Lh-zI/hqdefault.jpg?sqp=-oaymwEcCPYBEIoBSFfyq4qpAw4IARUAAIhCGAFwAcABBg==&rs=AOn4CLA2Xt0bBpcfb5166VYjRhbR92kn6Q,melanie martinez,1.4M,16 hours ago,14/06/2023,"'PORTALS' AVAILABLE Now: https://MelanieMartinez.lnk.to/PORTALSID Shop vinyl, merch, and more: https://store.melaniemartinezmusic.com/ Credits Directed by Melanie Martinez Executive Producer:..."
Elio | Teaser Trailer,https://www.youtube.com/watch?v=2w_K3CB8PuE,https://i.ytimg.com/vi/2w_K3CB8PuE/hqdefault.jpg?sqp=-oaymwEcCPYBEIoBSFfyq4qpAw4IARUAAIhCGAFwAcABBg==&rs=AOn4CLC2Evfk2MoM4VzZUQSIceaWsh_B8g,Pixar,1.6M,14 hours ago,14/06/2023,"An out-of-this-world teaser trailer for Disney and Pixar’s 28th feature film, “Elio,” are now available. Additions to the voice cast include: Jameela Jamil and Brad Garrett join previously..."
BTS (방탄소년단) 'Take Two' Live Clip #2023BTSFESTA,https://www.youtube.com/watch?v=owjVpYCmwcg,,BANGTANTV,4.5M,21 hours ago,14/06/2023,Connect with BTS: https://ibighit.com/bts http://twitter.com/BTS_bighit http://twitter.com/BTS_twt http://www.facebook.com/bangtan.official https://www.youtube.com/user/BANGTANTV http://instag...
Star Wars Outlaws: Official Gameplay Walkthrough | Ubisoft Forward,https://www.youtube.com/watch?v=c7K2TA0bBpY,,Ubisoft,2.3M,1 day ago,14/06/2023,"Watch the official gameplay walkthrough of Star Wars Outlaws. Experience the first ever open world Star Wars game and risk it all as Kay Vess, a scoundrel seeking freedom and the means to start..."
THIS AAU TEAM WANTED SMOKE WITH US IN THE CHAMPIONSHIP GAME!,https://www.youtube.com/watch?v=WU-tFMHdfFU,,Cam Wilder,494K,1 day ago,14/06/2023,"THE CHAMPIONSHIP GAME IS HEREEEEEEE! WE NEED 75K LIKES ON THIS VIDEO ASAPPPPPPPP !!! LIKE, COMMENT, SUBSCRIBE! Follow me on my socials below: Instagram: https://www.instagram.com/camwilderr/..."
I Put LeBron and Kobe In The Same Draft Class,https://www.youtube.com/watch?v=z2xe0NP2fPw,,Med,143K,15 hours ago,14/06/2023,"Instead of putting every NBA star into their prime except one person, today were taking two players from that series and putting them in the same draft class - the two being LeBron James and..."
[4K] Xbox Games Showcase + Starfield Direct,https://www.youtube.com/watch?v=qGtYn7DCIYo,,Xbox,2.9M,2 days ago,14/06/2023,"We’ve got a double feature for you! Join us for the Xbox Games Showcase, featuring new games from our incredibly talented internal studios and many creative partners from around the world,..."
The Weeknd Made a TV Show. It's a Complete Disaster.,https://www.youtube.com/watch?v=uRAoQOLUw-w,,D'Angelo Wallace,769K,1 day ago,14/06/2023,Thank you to Liquid I.V. for sponsoring today’s video! Click here https://bit.ly/43ulCJz to get free shipping with your purchase of a Hydration Sample Pack! The Idol directed by Euphoria's...
You Must Be A PRO To HOLE IN ONE! (Golf It),https://www.youtube.com/watch?v=-huTyGYh5ao,,Slogo,186K,14 hours ago,14/06/2023,⭐️ You Must Be A PRO To HOLE IN ONE! 🎉 NEW MERCH - https://slogo.com 😎 DISCORD - https://discord.gg/slogo 👬 MY FRIENDS! JELLY - https://youtu.be/LHAnmQlFeKg 👉 MORE VIDEOS!...
