title,url,thumbnail_url,channel,views,uploaded_time,scraped_time,description
I Survived On €0.01 For 1 Week,https://www.youtube.com/watch?v=7_hVt4Eq0qw,https://i.ytimg.com/vi/7_hVt4Eq0qw/hqdefault.jpg?sqp=-oaymwEcCPYBEIoBSFXyq4qpAw4IARUAAIhCGAFwAcABBg==&rs=AOn4CLD6Mb4A0PH6uT-I2FCQ4y5_1w9AGQ,Ryan Trahan,2.7M,15 hours ago,02/07/2023,1 penny. 1 week. 1 mission. donate here - https://give.water.org/f/penny/
"$50,000 Crystal Treasure Hunt",https://www.youtube.com/watch?v=eFmpqhvedt8,https://i.ytimg.com/vi/eFmpqhvedt8/hqdefault.jpg?sqp=-oaymwEcCPYBEIoBSFXyq4qpAw4IARUAAIhCGAFwAcABBg==&rs=AOn4CLCupORcK-QpF_9_lcTHCBntLNvf4g,Dude Perfect,1.8M,16 hours ago,02/07/2023,Crystal hunting ROUND 2! ► Thanks for subscribing! - http://bit.ly/SubDudePerfect ► Come see us in YOUR city! - http://dudeperfect.com/tour/ MUSIC: “Golden” Performed by Outasight...
Olivia Rodrigo - vampire (Official Music Video),https://www.youtube.com/watch?v=RlPNh_PBZb4,,Olivia Rodrigo,16M,2 days ago,02/07/2023,Listen to vampire out now: https://OliviaRodrigo.lnk.to/vampire Store: https://OliviaRodrigo.lnk.to/store Create a Short to vampire: https://yt.be/vampireOR2 Follow Olivia Rodrigo: Instagram:...
Juvenile: Tiny Desk Concert,https://www.youtube.com/watch?v=kes2P4IC2bQ,,NPR Music,1.4M,1 day ago,02/07/2023,"NPR Music is celebrating Black Music Month with an array of brand new Tiny Desk concerts. Together, these artists represent the past, present and future of Black music. This month of carefully..."
Meet my Boyfriend!,https://www.youtube.com/watch?v=RwfzvfFkyBw,,HJ Evelyn,1.4M,18 hours ago,02/07/2023,SURPRISE...the moment you all have been waiting for :p INSTAGRAM: https://www.instagram.com/HJEVELYN/ Shop everything mentioned in this video here: https://shopmy.us/collections/200205 Tekla...
Peso Pluma x Grupo Frontera - TULUM (Video Oficial),https://www.youtube.com/watch?v=mG_RN0oB4oE,,Peso Pluma,9.9M,2 days ago,02/07/2023,Peso Pluma x Grupo Frontera - TULUM (Video Oficial) Double P Records© Peso Pluma ⋟Instagram - https://bit.ly/3KxRYMd ⋟Spotify - http://bit.ly/435v7ii ⋟TikTok - http://bit.ly/3ZBp3LC...
"Shakira, Manuel Turizo - Copa Vacía (Official Video)",https://www.youtube.com/watch?v=oCxtsTU4BWg,,Shakira,14M,2 days ago,02/07/2023,Shakira & Manuel Turizo - Copa Vacía (Official Video) Music: Apple Music: https://SML.lnk.to/CV_/applemusic Spotify: https://SML.lnk.to/CV_/spotify Amazon: https://SML.lnk.to/CV_/amazonmusicstr...
I Transformed a Nether Portal in Survival Minecraft,https://www.youtube.com/watch?v=ZUGrmj7gdXI,,Wenzo,517K,19 hours ago,02/07/2023,"I built the World's Biggest Nether Portal on this Minecraft SMP, and showed it to my friends. This is Minecraft's Largest Nether Portal - Like ParrotX2 videos and the LifeSteal SMP, a Minecraft..."
I Built 4 Secret Gaming Bases You'd Never Find!,https://www.youtube.com/watch?v=11t0xgClpjc,,Unspeakable,1.2M,1 day ago,02/07/2023,Thanks to #BangEnergy for sponsoring this video! Use my code UNSPEAKABLE10 for 10% OFF of your order at https://BangEnergy.com Subscribe to: https://youtube.com/c/BangEnergy #EnergyDrink #ad...
The Quest to Beat abney317,https://www.youtube.com/watch?v=iqlUbLasZ-M,,Summoning Salt,836K,1 day ago,02/07/2023,🕹 Get a browser that’s literally better at everything: https://operagx.gg/SummoningSalt Sponsored by Opera GX! Merchandise - https://my-store-c98c64.creator-spring.com/ https://www.patreon.c...
