title,url,thumbnail_url,channel,views,uploaded_time,scraped_time,description
g3ox_em - GigaChad Theme (Phonk House Version),https://www.youtube.com/watch?v=OVh0bMNSFss,https://i.ytimg.com/vi/OVh0bMNSFss/hqdefault.jpg?sqp=-oaymwEjCPYBEIoBSFryq4qpAxUIARUAAIhCGAHYAQHiAQYIHBgGIAE=&rs=AOn4CLBro6I8w2LHDAzjsJP8xehi9BLMgg,g3ox_em,30M,5 months ago,03/02/2023,» Download/Stream: https://orcd.co/gigachadtheme-phonk 🔮 g3ox_em - Momentum OUT NOW: https://youtu.be/iubD8O9MLNI Production/Mix/Master : g3ox_em SUBSCRIBE 🔴 g3ox_em Official YT Channel:...
Bryan Cranston Fully Commits While Eating Spicy Wings | Hot Ones,https://www.youtube.com/watch?v=OXEteCPQcGc,https://i.ytimg.com/vi/OXEteCPQcGc/hqdefault.jpg?sqp=-oaymwEjCPYBEIoBSFryq4qpAxUIARUAAIhCGAHYAQHiAQYIHBgGIAE=&rs=AOn4CLD-FUia5J28mY0bvQejNZ_dDmOm9w,First We Feast,1.9M,14 hours ago,03/02/2023,"Bryan Cranston is a six-time Emmy Award–winning actor you know from acclaimed Broadway performances, films that include 2013's Best Picture Argo, and iconic TV shows like Malcolm in the Middle..."
Outer Banks 3 | Official Trailer | Netflix,https://www.youtube.com/watch?v=T0w8iL2vS04,https://i.ytimg.com/vi/T0w8iL2vS04/hqdefault.jpg?sqp=-oaymwEjCPYBEIoBSFryq4qpAxUIARUAAIhCGAHYAQHiAQYIHBgGIAE=&rs=AOn4CLAFGabzfgGpnLlUhqDok598V6kvTg,Netflix,1.6M,15 hours ago,03/02/2023,"Nothing to lose. Outer Banks S3 premieres Feb 23, only on Netflix. SUBSCRIBE: http://bit.ly/29qBUt7 About Netflix: Netflix is one of the world's leading entertainment services with 231 million..."
"Arcangel, Bad Bunny - La Jumpa (Video Oficial) | SR. SANTOS",https://www.youtube.com/watch?v=ubbE6gyBf8k,,Arcangel,2.2M,16 hours ago,03/02/2023,"Arcangel, Bad Bunny - La Jumpa Descarga La Jumpa: https://rimas.ffm.to/lajumpa SR. SANTOS ALBUM: https://rimas.io/SRSANTOS Suscríbete al Canal: https://RIMAS.lnk.to/ArcangelYT Redes Sociales:..."
The Sims 4 Growing Together Expansion Pack: Official Reveal Trailer,https://www.youtube.com/watch?v=2cnHYMrxAhc,,The Sims,575K,14 hours ago,03/02/2023,"Live a life full of important choices, memorable milestones, and dynamic relationships in The Sims™ 4 Growing Together Expansion Pack*, launching March 16 at 10 a.m. PT. Pre-order or buy..."
"NBA YoungBoy Talks About Fame, His Music, Changing His Ways & More | Billboard Cover",https://www.youtube.com/watch?v=q76TpEu5TXw,,Billboard,1.5M,1 day ago,03/02/2023,"NBA YoungBoy opens up and reflects on fame, his music, changing some of his ways, and more. To learn more about this story: https://www.billboard.com/music/features/youngboy-never-broke-again-cov..."
Ellen and Portia Renew Their Vows,https://www.youtube.com/watch?v=-e202SUj9fo,,TheEllenShow,602K,14 hours ago,03/02/2023,"At Portia’s birthday party, she surprised Ellen with a vow renewal ceremony officiated by Kris Jenner with a performance from Brandi Carlile. SUBSCRIBE: https://ellen.tv/3D6Sewq #ellen..."
Skinamarink Explained - A Forgotten Nightmare,https://www.youtube.com/watch?v=YJyO6YR_cXc,,Wendigoon,754K,1 day ago,03/02/2023,"Use this link to save $5 at Magic Spoon today! https://magicspoon.com/wendigoon Thank you to Magic Spoon for sponsoring the video! Kyle's Channel (fr tho, watch it, it's so good) - https://www.yo..."
AMBUSH SPAWNED IN THE LOBBY In My DOORS Run?!,https://www.youtube.com/watch?v=FoyhFnlsmeY,,Thinknoodles,529K,18 hours ago,03/02/2023,AMBUSH SPAWNED IN THE LOBBY In My DOORS Run?! Subscribe 🍜 https://www.youtube.com/channel/UChd1FPXykD4pust3ljzq6hQ?sub_confirmation=1 Subscribe to https://www.youtube.com/user/Thinkswife...
The Most INSANE R/C Airplane I've Ever Seen... He Let Me Fly It!!!,https://www.youtube.com/watch?v=f2A8_rNwYbk,,Cleetus2 McFarland,581K,14 hours ago,03/02/2023,Huge thank you to @mattsrcking for bringing out his CRAZY R/C jet! What an absolute unit!
