title,url,thumbnail_url,channel,views,uploaded_time,scraped_time,description
Lumi Athena - SMOKE IT OFF! ☆ (feat. jnhygs),https://www.youtube.com/watch?v=B41SCssaYOM,https://i.ytimg.com/vi/B41SCssaYOM/hqdefault.jpg?sqp=-oaymwEcCPYBEIoBSFXyq4qpAw4IARUAAIhCGAFwAcABBg==&rs=AOn4CLD9aUG3_Wrjh3wJKshyZqyFmQyxhw,Lumi Athena,5.6M,3 months ago,17/03/2023,Lumi Athena × Jnhygs - SMOKE IT OFF! ☆ Stream/Download - https://open.spotify.com/artist/1TTHC3GlNDaE5eVoC3BVxm Talk To Me! ☆ https://www.instagram.com/lumiathxna/ https://discord.gg/NCVuf2C...
Bad Bunny Carpool Karaoke,https://www.youtube.com/watch?v=jHIWuE3G9Aw,https://i.ytimg.com/vi/jHIWuE3G9Aw/hqdefault.jpg?sqp=-oaymwEcCPYBEIoBSFXyq4qpAw4IARUAAIhCGAFwAcABBg==&rs=AOn4CLBof-XWV2xuiTWYjvM-od0gyx-FUg,The Late Late Show with James Corden,3.2M,2 days ago,17/03/2023,James calls on Bad Bunny to help him beat the Los Angeles traffic. The most streamed artist in the world tells James how Benito became Bad Bunny and the two sing some of his most popular songs....
Air Segura VS Rain Man | YMH Original,https://www.youtube.com/watch?v=tl-OV3AZ23U,https://i.ytimg.com/vi/tl-OV3AZ23U/hqdefault.jpg?sqp=-oaymwEcCPYBEIoBSFXyq4qpAw4IARUAAIhCGAFwAcABBg==&rs=AOn4CLA09vuSEHLAyPvC2qhR6Vqx9HVnvQ,YMH Studios,485K,15 hours ago,17/03/2023,"What started as an off-handed comment by Tom Segura on 2 Bears, 1 Cave with guest Joe Rogan, turned into a local news story in Erie, PA. When Tom heard local weatherman David Wolter make a..."
Pedro Pascal In A Terrible Game Ad,https://www.youtube.com/watch?v=ZdcjEIaior0,,Danny Gonzalez,1.1M,1 day ago,17/03/2023,we love you pedro blink twice if you need help edited by Jake Mayer https://www.instagram.com/jakeshotfriend/ MERCH ► http://dannygonzalez.store Follow Me SECOND CHANNEL ► https://www.youtub...
"Conor McGregor: The MMA Hour Special In-Studio Edition | March 15, 2023",https://www.youtube.com/watch?v=RtOtXWEm9do,,MMAFightingonSBN,746K,Streamed 1 day ago,17/03/2023,"On this very special special edition of The MMA Hour, Conor McGregor drops by the NYC studios Wednesday night. The former two-division UFC champion will discuss his UFC return, TUF 31, and..."
GloRilla – Ex’s (PHATNALL Remix) (with Lil Durk) (Official Music Video),https://www.youtube.com/watch?v=EEwJQ5M8f5Q,,theofficialGloRilla,788K,1 day ago,17/03/2023,"Stream GloRilla's 'Anyways, Life's Great... Bonus Edition' out everywhere: https://glorilla.lnk.to/ALGBonus Follow #GloRilla: Instagram: https://www.instagram.com/glorillapimp/ TikTok: https://www..."
GASLIGHTING,https://www.youtube.com/watch?v=FxsNwm0k_R0,,sWooZie,250K,15 hours ago,17/03/2023,Gaslighting 101: Learn how to spot manipulators and take back your sanity with a sprinkle of humor. Stalk Me: ig: http://www.instagram.com/swoozie/ Art and animation by: https://www.instagram.com...
Stop Making Sense | Official Promo | A24,https://www.youtube.com/watch?v=mpGkipN30dc,,A24,326K,17 hours ago,17/03/2023,"SUBSCRIBE: http://bit.ly/A24subscribe If the suit still fits… This year, we’re bringing Jonathan Demme’s groundbreaking 1984 Talking Heads concert film STOP MAKING SENSE (newly remastered..."
The ULTIMATE Lego WAR...,https://www.youtube.com/watch?v=2E5fAuDqTtM,,SacredBricks,562K,1 day ago,17/03/2023,"SECOND CHANNEL (Extra scenes and fun content coming soon): https://www.youtube.com/channel/UCT0gFGoxjII6I6PR3Jr8uog Caveman a menace fr Thumbnail inspired by Mrbeast, tried to make it lego..."
Edwin Díaz suffers apparent leg injury after celebrating Puerto Rico's victory vs Dominican Republic,https://www.youtube.com/watch?v=T1zZ54gqX-c,,FOX Sports,486K,1 day ago,17/03/2023,Puerto Rico's closer Edwin Díaz suffered an apparent leg injury after celebrating victory over the Dominican Republic. #FOXSports #WBC #EdwinDíaz SUBSCRIBE to get the latest FOX Sports...
