title,url,thumbnail_url,channel,views,uploaded_time,scraped_time,description
FAST X | Official Trailer,https://www.youtube.com/watch?v=32RAq6JzY-w,https://i.ytimg.com/vi/32RAq6JzY-w/hqdefault.jpg?sqp=-oaymwEcCPYBEIoBSFXyq4qpAw4IARUAAIhCGAFwAcABBg==&rs=AOn4CLDYgxyuiu_Hq4M3tnOObHcYBgTBug,The Fast Saga,23M,2 days ago,13/02/2023,"The end of the road begins. Fast X, the tenth film in the Fast & Furious Saga, launches the final chapters of one of cinema’s most storied and popular global franchises, now in its third..."
Super Mario Bros. Plumbing Commercial,https://www.youtube.com/watch?v=pu57M7cjSD4,,Illumination,527K,8 hours ago,13/02/2023,"For Super Service Visit SMBPlumbing.com For super service, make it Super Mario Bros. Plumbing.  If you've got a problem with your pipes, plumbing's our game. As a family-owned and operated..."
Rushed my Fiancé to the EMERGENCY ROOM the Day after the Proposal…,https://www.youtube.com/watch?v=ujM487iP5I8,,GnB Official ,2.1M,3 days ago,13/02/2023,"Hey guys… so we know this is a different type of video and we didnt expectthis to happenaftwr such an amazing day by far our favorite day. But things happen, bad stuff happen for good to..."
Lost [Official Music Video] - Linkin Park,https://www.youtube.com/watch?v=7NK_JOkuSVY,,Linkin Park,9.7M,3 days ago,13/02/2023,"Download/Stream Lost : http://lprk.co/lost Video Credits:  Directors: Maciej Kuciara, pplpleasr Production Company: Shibuya - http://shibuya.xyz AI Production: Kaiber, Jacky Lu - https://kaibe..."
NRL Pre-Season 2023 | South Sydney Rabbitohs v Manly-Warringah Sea Eagles | Match Highlights,https://www.youtube.com/watch?v=2aIyuE7N4Ck,,NRL - National Rugby League,117K,2 days ago,13/02/2023,The South Sydney Rabbitohs host the Manly-Warringah Sea Eagles during Round 1 of the 2023 NRL Pre-Season Challenge 🏉 SUBSCRIBE FOR MORE NRL ACTION 🏉 https://www.youtube.com/channel/UC33-OkQ6...
NRL Pre-Season 2023 | New Zealand Warriors v Wests Tigers | Match Highlights,https://www.youtube.com/watch?v=jxnOPjbKRE0,,NRL - National Rugby League,172K,3 days ago,13/02/2023,The New Zealand Warriors host the Wests Tigers during Round 1 of the 2023 NRL Pre-Season Challenge 🏉 SUBSCRIBE FOR MORE NRL ACTION 🏉 https://www.youtube.com/channel/UC33-OkQ6VCYk8xtml8Pk4-g?...
Disney100 Special Look,https://www.youtube.com/watch?v=Xg69VWvHGOA,,Disney,200K,13 hours ago,13/02/2023,Disney’s 100th anniversary begins with a special look that honors the fans and storytellers who made this dream come true. #Disney100 SUBSCRIBE to get notified when new Disney videos are...
#DinnerWIthTheDon Valentines Edition with @MoneyBaggYoOfficial,https://www.youtube.com/watch?v=slS33eHWE70,,TheRealKyleSister,1.4M,3 days ago,13/02/2023,Pan Seared Chicken Breast Mashed Potatoes Sautéed Broccolini
Learning How to Speedrun Mario Odyssey in 1 Week,https://www.youtube.com/watch?v=gWQ9dP4f-eg,,Alpharad,505K,2 days ago,13/02/2023,➤ STREAM: http://twitch.tv/alpharad ➤ MERCH: http://pleasebuymymerch.com ➤ TWITTER: https://twitter.com/alpharad ➤ INSTAGRAM: https://www.instagram.com/alpharad #speedrun #supermarioodyssey...
Kevin Gates - Breakfast (Official Music Video),https://www.youtube.com/watch?v=pS0ARgkWESg,,kevingatesTV,1.3M,3 days ago,13/02/2023,Kevin Gates - Breakfast Stream ‘Breakfast’ Now! https://www.kevingates.lnk.to/breakfast Director: Gerard Victor Video Commissioner: Joseph Boyd Video Producer: Mally Brandon BTS: G-Town...
