title,url,thumbnail_url,channel,views,uploaded_time,scraped_time,description
BLACKPINK - ‘Pink Venom’ M/V,https://www.youtube.com/watch?v=gQlMMD8auMs,https://i.ytimg.com/vi/gQlMMD8auMs/hqdefault.jpg?sqp=-oaymwEcCPYBEIoBSFXyq4qpAw4IARUAAIhCGAFwAcABBg==&rs=AOn4CLANwYNrwXXFtPH9VNFfwq3g0qxutw,BLACKPINK,94M,1 day ago,20/08/2022,BLACKPINK - ‘Pink Venom’ M/V Kick in the door Waving the coco 팝콘이나 챙겨 껴들 생각 말고 I talk that talk Runways I walk walk 눈 감고 pop pop 안 봐도 척 One by...
So I Made Minecraft More Satisfying...,https://www.youtube.com/watch?v=1N22qIy_vHs,https://i.ytimg.com/vi/1N22qIy_vHs/hqdefault.jpg?sqp=-oaymwEcCPYBEIoBSFXyq4qpAw4IARUAAIhCGAFwAcABBg==&rs=AOn4CLBzXg3U-_gDko97FN4yu8Uil1VUyA,Fundy,1M,17 hours ago,20/08/2022,Download Monster Legends now and get my monster! https://monsterlegends.onelink.me/X4Sc/fundyaugust In this video I made minecraft a whole lot more satisfying by coding a custom mod/plugin/datapac...
AMP GOES TO THERAPY,https://www.youtube.com/watch?v=6M9UG1ueBZU,https://i.ytimg.com/vi/6M9UG1ueBZU/hqdefault.jpg?sqp=-oaymwEcCPYBEIoBSFXyq4qpAw4IARUAAIhCGAFwAcABBg==&rs=AOn4CLCUX7giSxHBvXgwP0NkYl0FAUygMA,AMP,1M,1 day ago,20/08/2022,NEW AMP Podcast channel!! SUBSCRIBE GANG https://bit.ly/3T0yPVB Join this channel for Exclusive AMP content: https://www.youtube.com/channel/UCJbYdyufHR-cxOuY96KIoqA/join Shoutout Patrick...
Spending The Day With A Loch Ness Monster Expert!,https://www.youtube.com/watch?v=WRhCmAgEmYs,,JiDion,1.9M,1 day ago,20/08/2022,Merch: https://justbeingme.co/ Twitch: https://www.twitch.tv/jidionpremium Instagram: https://www.instagram.com/jidion_/ Editor: https://www.instagram.com/hurseydagoat/ Intro song: https://youtu.b...
Finding out I'M PREGNANT...,https://www.youtube.com/watch?v=79cRYqRrNJQ,,JUSTKASS,561K,15 hours ago,20/08/2022,I took a pregnancy test on camera and found out that I'm PREGNANT!!! This was such an amazing and exciting day! I hope you all enjoy the video! WATCH MORE: https://www.youtube.com/watch?v=fa2SaLo9d...
Undercover Boss Of Checkers Restaurant Is Forced To Reveal Himself,https://www.youtube.com/watch?v=h6dL2un7YGg,,Dabl,1.1M,1 day ago,20/08/2022,"The Undercover Boss of Checkers Restaurant makes a tough choice and reveals himself to the crew, and gives a hardworking employee $15,000 to help out his mother. Watch Undercover Boss for..."
Bailey Zimmerman - Where It Ends (Lyric Video),https://www.youtube.com/watch?v=C7PHEPmdT1w,,Bailey Zimmerman,233K,1 day ago,20/08/2022,Bailey Zimmerman - Where It Ends (Lyric Video) 📱 Text me - 618.228.3400 or click the link https://my.community.com/baileyzimmerman Follow Bailey on Socials! http://www.tiktok.com/@bailey.zimme...
Nardwuar vs. Harry Styles,https://www.youtube.com/watch?v=TnGWa-kJaPw,,NardwuarServiette,686K,1 day ago,20/08/2022,Nardwuar interviews Harry Styles at the Coachella Music Festival ! Doot doo ! Nardwuar Merch and Links: https://linktr.ee/nardwuar
"Camilo, Grupo Firme - Alaska (Official Video)",https://www.youtube.com/watch?v=JLnBQuoCQZc,,Camilo,1.3M,1 day ago,20/08/2022,"Camilo, Grupo Firme - Alaska (Official Video) Música: Apple Music: https://Camilo.lnk.to/Alaska/applemusic Spotify: https://Camilo.lnk.to/Alaska/spotify Amazon: https://Camilo.lnk.to/Alaska/ama..."
How To Work For MrBeast,https://www.youtube.com/watch?v=ieKAhG_gdCw,,MrBeast 2,3.7M,1 day ago,20/08/2022,"If you're interested in working with us, check out the links below to apply! Senior Producer https://grnh.se/1aa1bc6d4us Lead Content Strategist (Producer/Writer) https://grnh.se/e758ea404us..."
