title,url,thumbnail_url,channel,views,uploaded_time,scraped_time,description
"Iam Tongi & James Blunt: Super Emotional Duet of ""Monsters"" Makes Idol History - American Idol 2023",https://www.youtube.com/watch?v=M9hdHDXyo-8,https://i.ytimg.com/vi/M9hdHDXyo-8/hqdefault.jpg?sqp=-oaymwEcCPYBEIoBSFXyq4qpAw4IARUAAIhCGAFwAcABBg==&rs=AOn4CLBGLKNzhsSirp4xiRaermzNQN5gZA,American Idol,1.9M,1 day ago,23/05/2023,"IDOL HISTORY: Season 21 WINNER Iam Tongi & James Blunt perform super emotional duet of ""Monsters"". 😭 #IdolFinaleSee more of American Idol 2023 on our official site: http://www.americanidol.com..."
Resumen y goles | América (2)1-3(3) Chivas | CL2023 - Semis | TUDN,https://www.youtube.com/watch?v=1D_iOST8060,,TUDN USA,845K,1 day ago,23/05/2023,La mayor oferta de partidos de la Liga Mx en ViX: https://vix.com/es-es/deportes?utm_medium=organic_social&utm_source=youtube&utm_campaign=evergreen&utm_content=ed_sports Un autogol de Cáceres...
ENHYPEN (엔하이픈) 'Bite Me' Official MV,https://www.youtube.com/watch?v=wXFLzODIdUI,,HYBE LABELS,12M,21 hours ago,23/05/2023,"ENHYPEN (엔하이픈) 'Bite Me' Official MV Credits: Production : LOVEANDMONEY Director : Mingyu Song 1st AD : Moonju Jeong Executive Producer : Mingi Kang Visual Creative: Serian Heu, Gunhee..."
The Return to Bloody Nights: Part 1,https://www.youtube.com/watch?v=3HGvOnEY_A0,,Markiplier,2.6M,1 day ago,23/05/2023,The Return to Bloody Nights is an amazing Five Nights at Freddy's fan game that drops you in and never lets go. Play The Return to Bloody Nights ► https://gamejolt.com/games/thereturntobloodyni...
HOLE-IN-ONE for Michael Block! | 2023 PGA Championship,https://www.youtube.com/watch?v=5tfeeaoOou0,,PGA Championship,601K,1 day ago,23/05/2023,"Michael Block's fairytale continued as he aced the 15th at Oak Hill during the final round of the 2023 PGA Championship. Subscribe now: https://bit.ly/PGAChampionshipYT Contested each May,..."
KSI Meet My Cat,https://www.youtube.com/watch?v=hHCfy8aZlXA,,JJ Olatunji,1.9M,15 hours ago,23/05/2023,"EASY - KSI, Bugzy Malone, R3HAB https://lnk.to/KSI-Easy Watch My Documentary: https://bit.ly/ksiinreallife Voices: 🎥 Watch the music official video: https://lnk.to/KSI-voices/YouTube 🎧Downl..."
Power Book IV: Force | Official Teaser | Season 2,https://www.youtube.com/watch?v=_knFMIPwzP0,,STARZ,176K,15 hours ago,23/05/2023,TOMMY. F******. EGAN returns Sept 1 on Starz. #powerforce #PowerNeverEnds #PowerTV Subscribe to the STARZ YouTube Channel for more Power: http://bit.ly/1kalhP0 Like Power Book IV: Force...
"We WASTED $20,000 on Custom Etsy Junk",https://www.youtube.com/watch?v=BStzTeSjQJw,,Cold Ones,993K,1 day ago,23/05/2023,"🌈BUY THE SHIRTS WE'RE WEARING with code ""COLDONES"" 👉🏻 http://bit.ly/asseenoncoldones 🥤 FOR 10% OFF YOUR GAMERSUPPS use code ""COLDONES"" 👉 https://bit.ly/coldonesGG 🅿️ Pledge..."
"Family, friends celebrate on Oahu's North Shore after Iam Tongi wins American Idol",https://www.youtube.com/watch?v=lMjcxAseHTQ,,KITV,255K,1 day ago,23/05/2023,"There was excitement all across the state of Hawaii after Iam Tongi became the next American Idol on Sunday. But no celebrations were as big as the ones held on Oahu's North Shore, where family..."
"Skyrim Speedrun, but I randomized all the doors",https://www.youtube.com/watch?v=vZnJpv0F0-s,,DougDougDoug,668K,1 day ago,23/05/2023,Skyrim has a lot of doors. Streaming live on Twitch! https://www.twitch.tv/dougdoug Full stream recording: https://www.youtube.com/watch?v=CAjBeaamJW4 MAIN CHANNEL: https://www.youtube.com/user/...
