title,url,thumbnail_url,channel,views,uploaded_time,scraped_time,description
SXMPRA - COWBELL WARRIORS! feat. Ski Mask the Slump God (Official Music Video),https://www.youtube.com/watch?v=0dT9siTP70Y,https://i.ytimg.com/vi/0dT9siTP70Y/hqdefault.jpg?sqp=-oaymwEcCPYBEIoBSFXyq4qpAw4IARUAAIhCGAFwAcABBg==&rs=AOn4CLAHw9iWoWKENA7yMezVpeKjmVZ1Xg,SXMPRA,889K,3 weeks ago,16/06/2023,THE WAIT IS OVER. OUT NOW EVERYWHERE. song link: https://sxmpra.lnk.to/cowbellwarriors Follow Sxmpra: Linktree: https://linktr.ee/sxmpra Instagram: https://www.instagram.com/sxmpra/ Soundcloud:...
#DinnerWithTheDon featuring K Hood @Rollitupk,https://www.youtube.com/watch?v=4pZ6ZFvuNtU,https://i.ytimg.com/vi/4pZ6ZFvuNtU/hqdefault.jpg?sqp=-oaymwE2CPYBEIoBSFXyq4qpAygIARUAAIhCGAFwAcABBvABAfgB_gmAAtAFigIMCAAQARhyIE0oMzAP&rs=AOn4CLDFUTZtvfvkG52igWTqGEvZXRwsMQ,TheRealKyleSister,789K,1 day ago,16/06/2023,#DinnerWithTheDon featuring K Hood @Rollitupk Todays Menu - Jerk Chicken Rice Broccoli Leave Comments for new menu ideas!! Instagram - Ari - https://www.instagram.com/therealkylesister/...
Hermitcraft 9: Episode 39 - THE BIG CLEAN,https://www.youtube.com/watch?v=6FY5Nk9GpWs,https://i.ytimg.com/vi/6FY5Nk9GpWs/hqdefault.jpg?sqp=-oaymwEcCPYBEIoBSFXyq4qpAw4IARUAAIhCGAFwAcABBg==&rs=AOn4CLAmktffPe7ULjMCwwhKv8mct3uaZw,Grian,584K,13 hours ago,16/06/2023,"Hermitcraft 9: Episode 39 - THE BIG CLEAN Grian is back on hermitcraft, becomes mumbos friend and makes HUGE progress. #minecraft #hermitcraft"
I Threw A Pool Party At The AMP HOUSE,https://www.youtube.com/watch?v=UQQBdxnZaZ8,,Duke Dennis,1.6M,1 day ago,16/06/2023,I Threw A Pool Party At The AMP HOUSE Follow me on Instagram: Duke_Dennis Follow me on Twitter: Imdukedennis
KAROL G - WATATI (feat. Aldo Ranks) (From Barbie The Album) [Official Music Video],https://www.youtube.com/watch?v=AqG0GF_LA0Q,,KAROL G,1.3M,14 hours ago,16/06/2023,Download/Stream: https://barbiethealbum.lnk.to/KarolGID Barbie The Movie and Barbie The Album available everywhere July 21st! Pre-order/save Barbie The Album: https://barbiethealbum.lnk.to/BTA!DL...
Apex Legends™ Dressed to Kill Collection Event Trailer,https://www.youtube.com/watch?v=itXcGea7DGo,,Apex Legends,486K,15 hours ago,16/06/2023,"Join the Dressed to Kill Collection Event and show the world you’re as dashing, driven, and deadly as any contract killer in the returning limited-time mode Armed and Dangerous – shotguns..."
MISAMO「Marshmallow」Music Video,https://www.youtube.com/watch?v=gAFgaI5D3Gc,,TWICE JAPAN OFFICIAL YouTube Channel,1.4M,15 hours ago,16/06/2023,MISAMO JAPAN 1st MINI ALBUM『Masterpiece』2023.7.26 Release 収録曲「Marshmallow」のMVが解禁！ 【いい音楽で一度、素晴らしいパフォーマンスで二度魅了させる...
Reviewing Japan.,https://www.youtube.com/watch?v=peloHl5sb4I,,PewDiePie,571K,13 hours ago,16/06/2023,Shop my OFFICIAL merch collection: https://bit.ly/pdpstore #Partner #AD: Amaze
I Cheated in a RAINBOW FRIENDS Mob Battle Competition!,https://www.youtube.com/watch?v=WP9JfCoLJec,,Dash,207K,16 hours ago,16/06/2023,"I Cheated in a RAINBOW FRIENDS Mob Battle Competition! (Minecraft) This video Dash and Rainey play a Minecraft Mob Battle but they can spawn in Rainbow Friends, from Rainbow Friends chapter..."
"Rebuilding A Flooded $2,000,000 McLaren P1 | Part 5",https://www.youtube.com/watch?v=2hI1IY782ig,,Tavarish,1.4M,1 day ago,16/06/2023,Get PayPal Honey for FREE today►https://joinhoney.com/tavarish Honey finds coupons with one click. Thanks to Honey for sponsoring! ----------------------------------------------------------------...
