title,url,thumbnail_url,channel,views,uploaded_time,scraped_time,description
I Survived On €0.01 For 1 Week - Day 3,https://www.youtube.com/watch?v=nA9klUeMRzY,https://i.ytimg.com/vi/nA9klUeMRzY/hqdefault.jpg?sqp=-oaymwEcCPYBEIoBSFXyq4qpAw4IARUAAIhCGAFwAcABBg==&rs=AOn4CLBKbRsNLy-WeT2dQUJhk5y4cTMLbQ,Ryan Trahan,3M,15 hours ago,04/07/2023,day 3. 1 penny. 1 mission. donate here - https://give.water.org/f/penny/
Overture Teaser: The Final Feast | Genshin Impact,https://www.youtube.com/watch?v=9SbgmM3mSps,,Genshin Impact,3.1M,1 day ago,04/07/2023,"Enjoy a rapturous ode sung in reverse, Enjoy a whirling waltz drowning in tears of joy and sorrow, Enjoy a magical performance for which none shall applaud... The actors have taken the stage,..."
"El Alfa ""El Jefe"" x Yandel, Lil Jon, Duki, Polimá Westcoast, El Cherry Scom - LA GRINGA",https://www.youtube.com/watch?v=WkoX7U3he3w,,ElAlfaElJefeTV,1.4M,12 hours ago,04/07/2023,Disponible en todas las plataformas digitales! https://ElJefe.lnk.to/ElAlfa Sigueme en las redes sociales: @ElAlfaElJefe @dherrera175 Pagina Oficial http://www.eljefemoneyrecord.com ©:...
Suicide Squad ISEKAI | Announcement | DC,https://www.youtube.com/watch?v=XSaBR58f7I0,,DC,886K,12 hours ago,04/07/2023,"💗#SuicideSquadISEKAI💙 Suicide Squad rampages into Japanese anime in SUICIDE SQUAD ISEKAI, an all-new original anime series collaboration with Warner Bros. Japan and WIT Studio! ▶️..."
I Survived On €0.01 For 1 Week - Day 2,https://www.youtube.com/watch?v=WAeN6cubmpo,,Ryan Trahan,4M,1 day ago,04/07/2023,day 2. 1 penny. 1 mission. donate here - https://give.water.org/f/penny/
Attack on Titan Final Season THE FINAL CHAPTERS Special 2 | OFFICIAL TRAILER,https://www.youtube.com/watch?v=8pEg8NrdL_Y,,Crunchyroll Collection,1.4M,1 day ago,04/07/2023,"Attack on Titan Final Season THE FINAL CHAPTERS Special 2 is coming to Crunchyroll 2023! Catch up with Attack on Titan here! https://got.cr/cc-aottfcpv Known in Japan as Shingeki no Kyojin,..."
Chicago Street Race: Grant Park 220 Extended Highlights | NASCAR,https://www.youtube.com/watch?v=XkNtOxnoHh0,,NASCAR,522K,1 day ago,04/07/2023,Relive the inaugural Grant Park 220 that saw a ton of action and a first time winner with an international flair. #NASCAR #ChicagoStreetRace #Chicago @SupercarsChampionship ---------- Subscribe...
Olivia Rodrigo - vampire (Official Lyric Video),https://www.youtube.com/watch?v=Fqey8LxQxFU,,Olivia Rodrigo,403K,14 hours ago,04/07/2023,Store: https://OliviaRodrigo.lnk.to/store Follow Olivia Rodrigo: Instagram: https://instagram.com/oliviarodrigo Twitter: https://twitter.com/Olivia_Rodrigo Facebook: https://www.facebook.com/Oli...
We shouldn't have milked this 🚫🥛,https://www.youtube.com/watch?v=8zIiVHlZkgU,,The Grumps,227K,13 hours ago,04/07/2023,"Cows have a lot of milking utility, as it turns out. 🐮🥛 Get the bigger, longer, uncut version on Patreon ► https://www.patreon.com/gamegrumps Click to SUBSCRIBE ► http://bit.ly/GrumpSub..."
JUN 'PSYCHO' Official MV,https://www.youtube.com/watch?v=2UlASdejUZk,,HYBE LABELS,1.1M,14 hours ago,04/07/2023,"JUN ‘PSYCHO’ Official MV Credits: PRODUCTION | MOSWANTD DIRECTOR | MOSWANTD (MINJUN LEE, HAYOUNG LEE) AD | YONGOH LEE PD | JAPA (WHATEVER) LINE PD | SENA LEE PA | JAEBEOM PARK, YEOHOON..."
