title,url,thumbnail_url,channel,views,uploaded_time,scraped_time,description
10 million subs elbow reveal,https://www.youtube.com/watch?v=KivZieyf3b0,https://i.ytimg.com/vi/KivZieyf3b0/hqdefault.jpg?sqp=-oaymwEcCPYBEIoBSFXyq4qpAw4IARUAAIhCGAFwAcABBg==&rs=AOn4CLB1vCYGBrRZyAdkaK5r-Vyyla0DDg,Technoblade,4M,1 day ago,27/12/2022,"Technodad here. For those of you who celebrate Christmas, MERRY CHRISTMAS! For everyone else, Happy December 25th! I'm sorry Alex didn't get to give you an elbow reveal while he was still..."
I Survived 50 Hours In Antarctica,https://www.youtube.com/watch?v=7IKab3HcfFk,,MrBeast,43M,2 days ago,27/12/2022,Check out my interview! http://bit.ly/Shopify-Behind-Beast Thank you to ALE https://antarctic-logistics.com/ Stream the Original song “Antartica or Bust” click a link below Spotify https://o...
'Can't talk dynasty!' 😳 Klay Thompson sends a message after BIG Christmas W | NBA on ESPN,https://www.youtube.com/watch?v=3zJCVrVD5Mg,,NBA on ESPN,480K,1 day ago,27/12/2022,Klay Thompson responds to Memphis Grizzlies' trash talk with some strong words after Warriors' big Christmas Day victory. ☑️ Subscribe to ESPN+: https://plus.espn.com/ 📱Get the ESPN...
Teaser Trailer | 60th Anniversary Specials | Doctor Who,https://www.youtube.com/watch?v=FtzRP0fycII,,Doctor Who,1.4M,1 day ago,27/12/2022,“The show is just beginning…” #DoctorWho returns in 2023 ❤️❤️➕🔷 Subscribe to Doctor Who for more exclusive videos: http://bit.ly/SubscribeToDoctorWho WATCH MORE: Compilations:...
King Charles and Family Depart from Church Service,https://www.youtube.com/watch?v=D5wlgnAyBpE,,The Royal Family Channel,1.2M,1 day ago,27/12/2022,"King Charles, The Queen Consort, The Prince and Princess of Wales along with other members of the Royal family depart St. Mary Magdalene Church following the annual Christmas service. Report..."
NBA YoungBoy - No Sleep,https://www.youtube.com/watch?v=hCEjuyr32_w,,YoungBoy Never Broke Again,1.9M,2 days ago,27/12/2022,"This shit crazy my nigga. I ain’t pray for this, I ain’t stay up all night for this. I won’t be broken. No matter what im thankful they wish i was fucked up Time then changed I will..."
Tampa Bay Buccaneers vs. Arizona Cardinals | 2022 Week 16 Game Highlights,https://www.youtube.com/watch?v=-7Gl5GI9JSE,,NFL,1.6M,1 day ago,27/12/2022,Check out our other channels: NFL Mundo https://www.youtube.com/mundonfl NFL Brasil https://www.youtube.com/c/NFLBrasilOficial NFL UK https://www.youtube.com/channel/UCVe0dAja_vZCmvfHXjtdRQA...
2HYPE SECRET SANTA #4!,https://www.youtube.com/watch?v=hlvqFt_0PZg,,2HYPE,625K,2 days ago,27/12/2022,★Follow us on Socials!★ ●Instagram https://www.instagram.com/2hypehouse/ ●Twitter https://twitter.com/official2HYPE 2HYPE ANIME CANVAS ARTIST: https://twitter.com/louisart7acc?s=21&t=na5US...
"GRIZZLIES at WARRIORS | FULL GAME HIGHLIGHTS | December 25, 2022",https://www.youtube.com/watch?v=uhFtOaDCYZM,,NBA,1.2M,1 day ago,27/12/2022,"Despite Ja Morant's 36 points, 7 rebounds and 8 assists, the Memphis Grizzlies fall to the Golden State Warriors, 123-109. Jordan Poole recorded 32 points, 3 rebounds and 2 assists for the..."
Denver Broncos vs. Los Angeles Rams | 2022 Week 16 Game Highlights,https://www.youtube.com/watch?v=nL4b607uriE,,NFL,928K,1 day ago,27/12/2022,Check out our other channels: NFL Mundo https://www.youtube.com/mundonfl NFL Brasil https://www.youtube.com/c/NFLBrasilOficial NFL UK https://www.youtube.com/channel/UCVe0dAja_vZCmvfHXjtdRQA...
