title,url,thumbnail_url,channel,views,uploaded_time,scraped_time,description
Luh Tyler - Back Flippin [Official Music Video],https://www.youtube.com/watch?v=yNcKvADGx1U,https://i.ytimg.com/vi/yNcKvADGx1U/hqdefault.jpg?sqp=-oaymwEcCPYBEIoBSFXyq4qpAw4IARUAAIhCGAFwAcABBg==&rs=AOn4CLB7ghilB3LIiKs-B864G4pNe35W0Q,Luh Tyler,1.5M,1 month ago,18/01/2023,Luh Tyler - Back Flippin Download/Stream: https://LuhTyler.lnk.to/BackFlippin Follow Luh Tyler Instagram: https://LuhTyler.lnk.to/Instagram Twitter: https://LuhTyler.lnk.to/Twitter Facebook:...
The Mandalorian | Season 3 Official Trailer | Disney+,https://www.youtube.com/watch?v=Znsa4Deavgg,https://i.ytimg.com/vi/Znsa4Deavgg/hqdefault.jpg?sqp=-oaymwEcCPYBEIoBSFXyq4qpAw4IARUAAIhCGAFwAcABBg==&rs=AOn4CLAwCaZPaGnnJlRH7SDbP-IsilQopg,Star Wars,4.8M,1 day ago,18/01/2023,"Reunited. The Mandalorian, Season 3 March 1 on Disney+. The journeys of the Mandalorian through the Star Wars galaxy continue. Once a lone bounty hunter, Din Djarin has reunited with Grogu...."
"Cowboys eliminate Tom Brady, Bucs for first road playoff win since 1992 | NFL | UNDISPUTED",https://www.youtube.com/watch?v=qNerIhdqSjI,https://i.ytimg.com/vi/qNerIhdqSjI/hqdefault.jpg?sqp=-oaymwEcCPYBEIoBSFXyq4qpAw4IARUAAIhCGAFwAcABBg==&rs=AOn4CLB0CyaGYV5XGrbV9VceAfeo_YJMyQ,Skip and Shannon: UNDISPUTED,524K,13 hours ago,18/01/2023,Dak Prescott had his best playoff game of his career last night in the 31-14 win over the Tampa Bay Buccaneers as the Dallas Cowboys easily covered as road favorites. Dak threw for over 300...
Dallas Cowboys vs. Tampa Bay Buccaneers | 2022 Super Wild Card Weekend Game Highlights,https://www.youtube.com/watch?v=fOfvRG0zlFs,,NFL,2.9M,1 day ago,18/01/2023,Check out our other channels: NFL Mundo https://www.youtube.com/mundonfl NFL Brasil https://www.youtube.com/c/NFLBrasilOficial NFL UK https://www.youtube.com/channel/UCVe0dAja_vZCmvfHXjtdRQA...
Destiny 2: Lightfall | Neomuna Environment Trailer,https://www.youtube.com/watch?v=gCEeCFlV0IA,,Destiny 2,496K,15 hours ago,18/01/2023,"A neon metropolis. Travel to a destination unlike any you've explored in Destiny 2. Cross paths with bone-chilling Tormentors and valiant Cloud Striders, join the fight against the Shadow..."
Dr Butcher Brown - Doin the lords work or a complete PSYCHO?! | Mystery & Makeup - Bailey Sarian,https://www.youtube.com/watch?v=alvFhaKwlq0,,Bailey Sarian,799K,1 day ago,18/01/2023,"Hi friends! How are you today? Look, I’m all about following your passions in life. But John Ronald Brown perhaps, took that too far. Today’s story is very graphic, but also I want to..."
Meet the new MacBook Pro and Mac mini | Apple,https://www.youtube.com/watch?v=6Ij9PiehENA,,Apple,3.4M,16 hours ago,18/01/2023,"Introducing the new MacBook Pro and Mac mini supercharged by the next generation of Apple silicon. Mac mini with M2 and M2 Pro is ready to flex in any setup, with its next-level performance,..."
SEC Shorts - SEC teams get their final 2022 season report cards,https://www.youtube.com/watch?v=NYQ8PLNcorI,,SEC Shorts,289K,16 hours ago,18/01/2023,It's that time of the year. SEC teams sit down to see how their teacher grades out their 2022 season. Who's going to the prize box and who's in danger of getting held back?
Keren Montero | Shy Singer SHOCKS The Judges With Her BIG Voice! | AGT: All-Stars 2023,https://www.youtube.com/watch?v=ByJafdBwmBI,,America's Got Talent,1.2M,1 day ago,18/01/2023,"16-year-old Keren Montero has a voice that will blow you away! Watch as Keren sings ""Rescue"" by Lauren Daigle. » Get The America's Got Talent App: http://bit.ly/AGTAppDownload » Subscribe..."
Binging with Babish: Pretty Patties from SpongeBob SquarePants,https://www.youtube.com/watch?v=tDnax8d3v3k,,Babish Culinary Universe,528K,15 hours ago,18/01/2023,This episode is sponsored by Cash App. Download Cash App from the App Store or Google Play store today to add your $cashtag to the 80 million and counting. Click here: http://www.cash.app/download....
