title,url,thumbnail_url,channel,views,uploaded_time,scraped_time,description
Ella Baila Sola - (Video Oficial) - Eslabon Armado y Peso Pluma - DEL Records 2023,https://www.youtube.com/watch?v=lZiaYpD9ZrI,https://i.ytimg.com/vi/lZiaYpD9ZrI/hqdefault.jpg?sqp=-oaymwEcCPYBEIoBSFXyq4qpAw4IARUAAIhCGAFwAcABBg==&rs=AOn4CLAJBD5D-ZCqgBmLNeRzx5ikZKkR8Q,DEL Records,3.8M,1 day ago,09/04/2023,"Mira el video oficial de “Ella Baila Sola” de Eslabon Armado y Peso Pluma. Descarga ""https://delrec.io/ellabailasola"" | Suscribete al canal oficial de Eslabon Armado https://bit.ly/3gc4rmJ..."
Ahsoka | Teaser Trailer | Disney+,https://www.youtube.com/watch?v=HnzNZ0Mdx4I,https://i.ytimg.com/vi/HnzNZ0Mdx4I/hqdefault.jpg?sqp=-oaymwEcCPYBEIoBSFXyq4qpAw4IARUAAIhCGAFwAcABBg==&rs=AOn4CLBZqOfwAHcbfcQ1T_-GuT7C1OSkYg,Star Wars,8.4M,1 day ago,09/04/2023,Warrior. Outcast. Rebel. Jedi. #Ahsoka arrives August 2023 on @DisneyPlus.
ALL ACCESS: Gervonta Davis vs. Ryan Garcia | Ep 2 | Full Episode | #davisgarcia,https://www.youtube.com/watch?v=vpdX4qTdamE,,SHOWTIME Sports,915K,14 hours ago,09/04/2023,Episode 2 of the Emmy® winning series brings viewers beyond the ring with unprecedented access as undefeated boxing superstars Gervonta “Tank” Davis and “King” Ryan Garcia prepare...
MURDER DRONES - Episode 4: Cabin Fever,https://www.youtube.com/watch?v=63bUBEIhpNk,,GLITCH,2.2M,1 day ago,09/04/2023,We goin campin' 🏕️ ... Uzi you ok? N IS A PILLOW ► http://murderdrones.store/
Jack Black - Peaches (Directed by Cole Bennett) The Super Mario Bros. Movie,https://www.youtube.com/watch?v=aW7bzd8uwyQ,,Lyrical Lemonade,2.8M,1 day ago,09/04/2023,Lyrical Lemonade Presents “Peaches” (from The Super Mario Bros. Movie) by Jack Black https://backlotmusic.ffm.to/peaches The Super Mario Bros. Movie only in theaters now. Tickets: http://th...
Indiana Jones and the Dial of Destiny | Official Trailer,https://www.youtube.com/watch?v=eQfMbSe7F2g,,Lucasfilm,7.3M,1 day ago,09/04/2023,Indiana Jones and the Dial of Destiny in theaters June 30. Harrison Ford returns as the legendary hero archaeologist in the highly anticipated fifth installment of the iconic “Indiana Jones”...
I Played Gorilla Tag 2...,https://www.youtube.com/watch?v=LteIygVUIwY,,jmancurly,508K,15 hours ago,09/04/2023,"Use this link to get an airup bottle! https://airup.link/3MmzD68 #airup #airuppartner Join the Discord to chat with me, other great people, and to be in my videos! https://www.discord.gg/jmancurly..."
YoungBoy Never Broke Again feat. Nicki Minaj - WTF ( Official Music Video),https://www.youtube.com/watch?v=MM1wJ2bMPhQ,,YoungBoy Never Broke Again,2.2M,2 days ago,09/04/2023,Official Music Video for WTF
Coding Your Explosive Minecraft Ideas,https://www.youtube.com/watch?v=wLPfat-9_nI,,doctor4t,335K,16 hours ago,09/04/2023,"After adding a giant airship to Minecraft and blowing it up, I feel nothing I can code and mod would be crazy enough, so I did the craziest thing: asking for your ideas and my YouTuber friends'..."
100 YouTubers sent me a Pokémon for a Nuzlocke,https://www.youtube.com/watch?v=udKGby4E5nE,,Alpharad,1.1M,1 day ago,09/04/2023,Thank you to all of the creators who gave me a good egg for this run... and for those of you who didn't... ➤ STREAM: http://twitch.tv/alpharad ➤ MERCH: http://pleasebuymymerch.com ➤ TWITTER:...
