title,url,thumbnail_url,channel,views,uploaded_time,scraped_time,description
HELLUVA BOSS - THE CIRCUS // S2: Episode 1,https://www.youtube.com/watch?v=_spuxXnul0U,https://i.ytimg.com/vi/_spuxXnul0U/hqdefault.jpg?sqp=-oaymwEcCPYBEIoBSFXyq4qpAw4IARUAAIhCGAFwAcABBg==&rs=AOn4CLC7y1iJSswuaVSN80cgb5m9ICLFzA,Vivziepop,3.7M,13 hours ago,31/07/2022,So you guys like backstories? Cuz things sure did happened. WARNING: for daddy issues. HELLUVA BOSS MERCH AVAILABLE ► https://sharkrobot.com/vivziepop HELLUVA SEASON TWO IS HERE!! Thank...
"Minecraft Speedrunner VS $1,000,000 MrBeast Challenge",https://www.youtube.com/watch?v=wwkH0prchjQ,https://i.ytimg.com/vi/wwkH0prchjQ/hqdefault.jpg?sqp=-oaymwEcCPYBEIoBSFXyq4qpAw4IARUAAIhCGAFwAcABBg==&rs=AOn4CLAwMFRYZMnMBnhYVUs2p0yRNlohMw,Dream,6.2M,21 hours ago,31/07/2022,"Minecraft Speedrunner VS $1,000,000 MrBeast Challenge. This was INSANE. A new challenge. Patreon (Plugin): https://www.patreon.com/DreamWasTaken Free $15 with Code DREAMYT: http://cash.app/13+..."
MM07292022,https://www.youtube.com/watch?v=zD6SWDm1zf4,https://i.ytimg.com/vi/zD6SWDm1zf4/hqdefault.jpg?sqp=-oaymwE2CPYBEIoBSFXyq4qpAygIARUAAIhCGABwAcABBvABAfgBgAqAAtAFigIMCAAQARgYIC4ofzAP&rs=AOn4CLDChUuVAYmBTB6kSYoH99Wubr7yMA,MegaMillions,480K,1 day ago,31/07/2022,"$1 Billion Mega Millions Jackpot - Friday, 29 July, 2022. Good Luck Everyone!"
"Dream - MrBeast $1,000,000 Challenge (Extra Scenes)",https://www.youtube.com/watch?v=-capZjxVKiM,,DreamXD,751K,20 hours ago,31/07/2022,"This is extra scenes from Dream's channel of the ""Minecraft Speedrunner VS Mr Beast $1,000,000 Challenge"" video. Free $15 with Code DREAMYT download cashapp now: http://cash.app/13+ Original..."
It's been a minute...,https://www.youtube.com/watch?v=jXrxDKwlA_s,,Will Smith,2.7M,1 day ago,31/07/2022,Thanx y’all
Note Block Universe - Animation vs. Minecraft Shorts Ep 29,https://www.youtube.com/watch?v=4P6l35M61GY,,Alan Becker,3.3M,18 hours ago,31/07/2022,Green has to use music to ask where Purple went. 🖐 ASK ME ANYTHING! https://www.youtube.com/noogai89/join 👕 MERCH! https://store.alanbecker.store 💬DISCORD SERVER ► https://discord.gg/...
"MrBeast Hit 100,000,000 Subs So I Did This...",https://www.youtube.com/watch?v=k_Xwk6Afo1U,,Preston,2M,15 hours ago,31/07/2022,"Preston’s Back to School Bundles and Giveaway are now LIVE on firemerch.com (http://firemerch.com/) 👊 Don’t forget to enter🔥 MrBeast Hit 100,000,000 Subs So I Did This...with Preston..."
"CA sheriff orders raid on Indiana Batmobile garage, allegedly as favor for friend - EXCLUSIVE",https://www.youtube.com/watch?v=SiM1At3O53E,,ABC7 News Bay Area,1.9M,1 day ago,31/07/2022,"Holy political favors, Batman! That's the allegation against San Mateo County Sheriff Carlos Bolanos for sending a four-man team across the country last week, to raid the garage that builds..."
Harry Styles Audition: EXTENDED CUT | The X Factor UK,https://www.youtube.com/watch?v=p_VssaTwwLY,,The X Factor UK,278K,15 hours ago,31/07/2022,"Meet Harry Styles again for the very first time, but with EXTRA footage that's never been aired before! Featuring an unseen performance of Train's 'Hey, Soul Sister'. SUBSCRIBE: http://bit.ly/TX..."
"LAST TO LEAVE BACKYARD TRAMPOLINE PARK WINS $10,000!!",https://www.youtube.com/watch?v=FFAlxxnO6iU,,Carter Sharer,332K,16 hours ago,31/07/2022,"🔥SHOP NOW!!🔥━► https://www.teamrar.com/ We built an entire TRAMPOLINE PARK in the back yard of our new Team RAR house, and we're doing a LAST TO LEAVE challenge for $10,000!! Our..."
