title,url,thumbnail_url,channel,views,uploaded_time,scraped_time,description
"GloRilla, Cardi B - Tomorrow 2 (Official Music Video)",https://www.youtube.com/watch?v=zwa7NzNBQig,https://i.ytimg.com/vi/zwa7NzNBQig/hqdefault.jpg?sqp=-oaymwEcCPYBEIoBSFXyq4qpAw4IARUAAIhCGAFwAcABBg==&rs=AOn4CLBj8zaekxQlRHhv0ZoeKWVk7r4SuQ,theofficialGloRilla,3.1M,1 day ago,24/09/2022,Stream #Tomorrow2' here: https://GloRilla.lnk.to/Tomorrow2 Follow #GloRilla: Instagram: https://www.instagram.com/glorillapimp/ TikTok: https://www.tiktok.com/t/ZTR6WV6SC/ Facebook: https://www.f...
So I Made Minecraft EVEN MORE Satisfying...,https://www.youtube.com/watch?v=r9_DkfLkkY8,https://i.ytimg.com/vi/r9_DkfLkkY8/hqdefault.jpg?sqp=-oaymwEcCPYBEIoBSFXyq4qpAw4IARUAAIhCGAFwAcABBg==&rs=AOn4CLDXwDdSN2NE2M1pZtbCf0ao7fOhcA,Fundy,756K,17 hours ago,24/09/2022,"THE YOUTOOZ: https://youtooz.com/collections/fundy So I made Minecraft EVEN MORE Satisfying.. every episode seems to get crazier than the last, and I love it. Twitch (I STREAM A LOT): https://www...."
BOOGEYMAN,https://www.youtube.com/watch?v=l_HpGo8-AQs,https://i.ytimg.com/vi/l_HpGo8-AQs/hqdefault.jpg?sqp=-oaymwEcCPYBEIoBSFXyq4qpAw4IARUAAIhCGAFwAcABBg==&rs=AOn4CLBtlTDZeB_2L_JLl5tx6iDmWhXwFg,DaBaby,345K,1 day ago,24/09/2022,Provided to YouTube by Universal Music Group BOOGEYMAN · DaBaby Baby On Baby 2 ℗ 2022 Interscope Records Released on: 2022-09-23 Producer: jetsonmade Producer: Lil Ty Producer: Jee...
DABABY - SOCKS (Official Video),https://www.youtube.com/watch?v=3nat8_GSuUE,,DaBaby,396K,19 hours ago,24/09/2022,
Ovi x Kim Loaiza x Grupo Firme x Pailita - Después de las 12 REMIX (Video Oficial),https://www.youtube.com/watch?v=cb493eOrYK0,,Kim Loaiza,4.1M,1 day ago,24/09/2022,"Ovi x Kim Loaiza - Después de las 12 REMIX (Video Oficial) Ft. Grupo Firme, Pailita Disponible en todas las plataformas: https://WML.link/OviKimLoaizaPailitaGrupoFirmeDespuesDeLas12Remix..."
I Built Custom Biomes in Minecraft Hardcore,https://www.youtube.com/watch?v=v7MTD0Gu7n4,,aCookieGod,1M,18 hours ago,24/09/2022,I Created Custom Biomes in Hardcore Minecraft 🔥 Watch From EPISODE #1: https://www.youtube.com/watch?v=EDYifz45dhU&list=PLqyCqmSEa8cTmHfheGsE70w9uzcas3BFH 📺 Watch my LAST EPISODE: https://y...
I've been trying to find this movie for 10 years,https://www.youtube.com/watch?v=YZDFAmaaa6E,,Drew Gooden,1.5M,1 day ago,24/09/2022,CASETiFY’s iPhone 14 Impact Case Series is now available at casetify.com! Go to http://casetify.com/drewgooden today to save 15% off your order! Sponsored by CASETiFY. https://www.daddycantdance...
"Adam Calhoun - ""Ramble On""",https://www.youtube.com/watch?v=ZQt4vbEobUE,,Adam Calhoun,335K,14 hours ago,24/09/2022,Download and Listen here - https://vydia.lnk.to/RambleOn
"Boosie Badazz, Big Boogie, Tootie Raww - Slide Then (Official Video)",https://www.youtube.com/watch?v=x3bqbzSmuSc,,OfficialBoosie,285K,1 day ago,24/09/2022,"Music video by Boosie Badazz, Big Boogie, Tootie Raww performing Slide Then (Official Video). http://vevo.ly/XMcjoQ"
Sam Smith - Unholy (ft. Kim Petras) (Lyric Video),https://www.youtube.com/watch?v=7QXDnWRy6MI,,SAM SMITH,1.8M,1 day ago,24/09/2022,Sam Smith - Unholy feat Kim Petras (Out Now) Listen at http://samsmith.world/UnholyID Listen to Sam Smith’s Complete Collection here: http://samsmith.world/CatalogueID Stay up to date...
