title,url,thumbnail_url,channel,views,uploaded_time,scraped_time,description
Deion Sanders receives his flowers from Shannon Sharpe | Ep. 65 | CLUB SHAY SHAY,https://www.youtube.com/watch?v=P1Ohc8GDFPI,,Club Shay Shay,1.1M,1 day ago,22/12/2022,"Club Shay Shay heads to Boulder, Colorado this week, with Shannon paying a visit to new Colorado HC Deion Sanders for an exclusive interview. Unc x Prime, nothing else to say! #ClubShayShay..."
BADGER'S BEST OF 2022,https://www.youtube.com/watch?v=IltuQkeU7zU,,TheRussianBadger,1.3M,1 day ago,22/12/2022,BUY MY SHAKER CUP (use code BADGER for 10% off): https://gamersupps.gg/badger 00:00 - Thank You/Update 04:22 - FUN PART FOLLOW ME HERE ▼ ➧ Twitter: https://twitter.com/DARUSSIANBADGER...
Cheating at boxing in front of millions of people,https://www.youtube.com/watch?v=QNuu8KTUEwU,,I did a thing,1.1M,15 hours ago,22/12/2022,Get PayPal Honey for FREE today ▸ https://joinhoney.com/ididathing Honey finds coupons with one click. Thanks to Honey for sponsoring! A big thanks to @Boy_Boy @Myth_YT @HasanAbi Twitter:...
Unbelievable! The Yellow Submarine Engine Starts Up After Being Under the Water for 30 Years!,https://www.youtube.com/watch?v=5ghmYGk4KT8,,Merlins Old School Garage,462K,18 hours ago,22/12/2022,"@MerlinsOldSchoolGarage @FabRats Will this old engine that has been under water for 30 years run? After some cleanup you might be surprised... The entire crew sure was! Paul, Ben, Merlin,..."
"6 months of heartbreak, documented",https://www.youtube.com/watch?v=4e2ZqOsJd9M,,Paulina Torres,383K,1 day ago,22/12/2022,"I documented my breakup/heartbreak and I wanted to share the healing process with you. I get messages every single day from girls asking me how I healed and moved on from my breakup, this video..."
AI learns to WALK 3D (Part 2),https://www.youtube.com/watch?v=9amJuvb3grU,,Code Bullet,654K,18 hours ago,22/12/2022,Get an Exclusive NordVPN deal here: https://nordvpn.com/CodeBullet It's risk-free with Nord's 30-day money-back guarantee! WATCH PART 1: https://youtu.be/qvpXpCvkqbc Twitter: https://twitter.com/...
Minecraft's Funniest Cooking Show...,https://www.youtube.com/watch?v=r5T4TMIXDqM,,TommyInnit,1M,1 day ago,22/12/2022,"Today TommyInnit, Schlatt, Slimecicle & start a Minecraft Diner. This was SO FUNNY! Edited by Tommy + THE AMAZING @onlyantics & the Mediocre @LarryTL. Big shoutout, they did epic on this ..."
The Unexplainable Disappearance of Dennis Martin - Missing 411,https://www.youtube.com/watch?v=TZAL-CNnP7k,,Wendigoon,527K,1 day ago,22/12/2022,"Let Audible help you discover new ways to laugh, be inspired, or be entertained. New members can try it free for 30 days. Visit https://Audible.com/wendigoon or text wendigoon to 500-500. ..."
Game Theory: This is Not My Channel,https://www.youtube.com/watch?v=dJfE5U6gn9g,,The Game Theorists,1.9M,1 day ago,22/12/2022,"Friends, today is a BIG day! I am so excited to finally be sharing this news with you all and letting you in on what Steph and I have been working on for so long! The future for the channels..."
UNDERVERSE 0.7 Part 1 [By Jakei],https://www.youtube.com/watch?v=vRpQBcXX2oc,,Jael Peñaloza,463K,16 hours ago,22/12/2022,- CONSIDER MY PATREON - https://www.patreon.com/jakeinimation ================== -ORIGINAL SOUNDTRACK By @NyxTheShieldOFFICIAL https://youtube.com/playlist?list=PLDJXXLjk04x35GpIUiGML8eJcQScoHrD2...
