title,url,thumbnail_url,channel,views,uploaded_time,scraped_time,description
PSG vs Lille | LIGUE 1 HIGHLIGHTS | 02/19/2023 | beIN SPORTS USA,https://www.youtube.com/watch?v=Zc2khqqm_aI,https://i.ytimg.com/vi/Zc2khqqm_aI/hqdefault.jpg?sqp=-oaymwEcCPYBEIoBSFXyq4qpAw4IARUAAIhCGAFwAcABBg==&rs=AOn4CLC9F6a4t_fVXscjVeIsGXB99GJBjg,beIN SPORTS USA,704K,15 hours ago,20/02/2023,"PSG defeated Lille thanks to a masterful goal from Lionel Messi. #ligue1 #psg #lille Catch the latest highlights of Ligue 1🇫🇷, Turkish Süper Lig🇹🇷, Copa Libertadores🏆,..."
The FULL 2023 NBA #ATTSlamDunk Contest! 👀 | 2023 #NBAAllStar,https://www.youtube.com/watch?v=awLQ_A33H9Y,,NBA,5.4M,1 day ago,20/02/2023,"Mac McClung has won the 2023 AT&T Slam Dunk Contest with a multiple perfect score performance. #StateFarmSaturday Never miss a moment with the latest news, trending stories and highlights..."
"Game Theory: FNAF, The Rise Of Afton (Ultimate Timeline)",https://www.youtube.com/watch?v=oLj9qS9EgB8,,The Game Theorists,3.3M,1 day ago,20/02/2023,"*SUBSCRIBE to Style Theory!* Be one of the first to subscribe to our NEW channel! ► https://bit.ly/styletheorysub Friends, today I’m back with part 2 of our FNAF timeline, what we’re..."
I Built an Unethical Zoo Where You Make Your Own Unethical Zoo - Planet Zoo,https://www.youtube.com/watch?v=pPPp9umYZFs,,Let's Game It Out,855K,14 hours ago,20/02/2023,Download Empires & Puzzles here ► https://pixly.go2cloud.org/SH3ga Thanks to Empires & Puzzles for sponsoring! JOIN MY STREAMS! ► https://www.twitch.tv/letsgameitout Merch! ► http://bit.ly...
Extreme Hide & Seek in World's Largest Bounce House,https://www.youtube.com/watch?v=JYI95jCLBPk,,Jordan Matter,3.6M,1 day ago,20/02/2023,"Only one YouTuber will win an incredible yacht trip to Cancun, Mexico! Subscribe and comment and you could be featured in the next video! https://www.youtube.com/user/jordanmatter See Yacht's..."
Style Theory: These Shoes can KILL!,https://www.youtube.com/watch?v=x629nYBuLpY,,The Style Theorists,1.1M,1 day ago,20/02/2023,"*SUBSCRIBE to Style Theory!* Be one of the first to subscribe to our NEW channel! ► https://bit.ly/styletheorysub You’ve heard the term “killer heels,” right? Like “these heels are..."
Hide and Seek with Our Daughter for the First Time,https://www.youtube.com/watch?v=Y3t8ToLh52k,,Matt Slays,408K,13 hours ago,20/02/2023,"Can Zadie find Matt Slays or his wife Rebecca Zamolo in an epic game of hide and seek. It all started when Rebecca Zamolo posted ""Surviving Every Netflix Show in 24 Hours."" Next Matt Slays..."
It's A Fast BEAST...The World's Largest Off Road Wrecker!,https://www.youtube.com/watch?v=qmQjyVc1Z34,,Matt's Off Road Recovery,781K,16 hours ago,20/02/2023,So I got a build and it's fully running! Will You Win The Can-Am Maverick? https://www.mattsoffroadadventures.com Check Out Tom's Bird House. https://www.ebay.com/itm/234904593586 Subscribe...
The FULL 2023 NBA #Starry3PT Contest 🎯 | 2023 #NBAAllStar,https://www.youtube.com/watch?v=fVq7w22Af2Q,,NBA,3.4M,1 day ago,20/02/2023,Damian Lillard has won the 2023 Starry 3-Point Contest with a score of 26. #StateFarmSaturday CHAMPIONSHIP ROUND Damian Lillard 26 Buddy Hield 25 Tyrese Haliburton 17 Never miss a moment...
First Visit to the Country that Sold Me A Passport,https://www.youtube.com/watch?v=QO7Ymd99RtY,,Yes Theory,505K,12 hours ago,20/02/2023,Make sure you check out https://eu.seekdiscomfort.com/ for the newest drop out now with no custom charges and lower shipping costs for anyone in Europe! Thank you for supporting Yes Theory...
