title,url,thumbnail_url,channel,views,uploaded_time,scraped_time,description
Doechii - What It Is (Block Boy) feat. Kodak Black [Official Video],https://www.youtube.com/watch?v=phtcAd8j6Ro,https://i.ytimg.com/vi/phtcAd8j6Ro/hqdefault.jpg?sqp=-oaymwEcCPYBEIoBSFXyq4qpAw4IARUAAIhCGAFwAcABBg==&rs=AOn4CLA1wGL3ITyyun_tFYCyuh14iwYCrg,Doechii,4.9M,1 month ago,03/05/2023,"Stream//Download ""What It Is"" (Versions) here: https://doechii.lnk.to/WhatItIs Follow Doechii Everywhere: Instagram: https://doechii.lnk.to/Instagram TikTok: https://doechii.lnk.to/TikTok..."
Live at the Met Gala With Vogue,https://www.youtube.com/watch?v=LHCTW4pckDo,https://i.ytimg.com/vi/LHCTW4pckDo/hqdefault.jpg?sqp=-oaymwEcCPYBEIoBSFXyq4qpAw4IARUAAIhCGAFwAcABBg==&rs=AOn4CLAY2oviZ8J4i0qNkRoxSsVoCRG67g,Vogue,,Streamed 1 day ago,03/05/2023,"For the third year in a row, Vogue will be hosting the official Met Gala red carpet livestream on Monday, May 1, giving viewers the inside look at one of the most anticipated—and star-studded—e..."
DUNE 2 Trailer Teaser (2023),https://www.youtube.com/watch?v=QpVS9pEx46k,https://i.ytimg.com/vi/QpVS9pEx46k/hqdefault.jpg?sqp=-oaymwEcCPYBEIoBSFXyq4qpAw4IARUAAIhCGAFwAcABBg==&rs=AOn4CLCm_vI2J9iaqadM5-l_r3y499VIrg,ONE Media,886K,13 hours ago,03/05/2023,"DUNE 2 Trailer Teaser (2023) Timothée Chalamet, Zendaya, Florence Pugh, Austin Butler © 2023 - Warner Bros"
Why Iran is Helping Russia’s Invasion of Ukraine,https://www.youtube.com/watch?v=LXIu9YEr7UM,,RealLifeLore,516K,15 hours ago,03/05/2023,Get Nebula using my link for 40% off an annual subscription: https://go.nebula.tv/reallifelore Watch my exclusive video covering the Syrian Civil War here: https://nebula.tv/videos/reallifelore-mod...
Video: Search for 2 missing girls over after authorities found 7 bodies on property near Henryetta,https://www.youtube.com/watch?v=NAmvqS0zuzA,,FOX23 News Tulsa,659K,1 day ago,03/05/2023,The search for two missing girls is over after seven bodies were found on a property near Henryetta.
aespa 에스파 'Welcome To MY World (Feat. nævis)' MV,https://www.youtube.com/watch?v=0xdB_vo4r2c,,SMTOWN,5.2M,21 hours ago,03/05/2023,"aespa's new single ""Welcome To MY World"" is out! Listen and download on your favorite platforms: https://aespa.lnk.to/MYWORLD-minialbum aespa's 3rd Mini Album ""MY WORLD"" will be released on..."
Harry Styles - Satellite (Coming Soon),https://www.youtube.com/watch?v=GlOf2rvvv-k,,Harry Styles,293K,14 hours ago,03/05/2023,"Official Trailer for “Satellite” by Harry Styles. Join the ""Satellite"" Premiere Page: https://hstyles.lnk.to/Satellite Harry's new album ""Harry's House"" out now. Listen here: https://hstyles.l..."
This Is Going To Completely Change Our Weather…,https://www.youtube.com/watch?v=nkFfz4vw1Sg,,"Ryan Hall, Y'all",1.1M,1 day ago,03/05/2023,Get a personal weather station here: https://shopryanhall.com/ Subscribe to our new YALL SQUAD channel: https://www.youtube.com/channel/UCzuHn2AyOc5XLY8T21f-ezg In this video we are talking...
Kylie Jenner & Kendall Jenner Are Having a Met Gala Girls Night | Met Gala 2023 | Vogue,https://www.youtube.com/watch?v=a6D1L92ne0E,,Vogue,1.5M,1 day ago,03/05/2023,"Emma Chamberlain stops Kylie Jenner and Kendall Jenner on the Met Gala red carpet to discuss their looks for the evening, talk about what sets them apart from one another, and invite Emma to..."
"Reacting to the Met Gala's ""colgate carpet"" looks 🫠",https://www.youtube.com/watch?v=O27iiZcpzVk,,Mina Le,290K,12 hours ago,03/05/2023,PODCAST Spotify: https://open.spotify.com/show/3wvGhhd3yGEJhak11myA5N Apple Podcasts: https://podcasts.apple.com/us/podcast/high-brow/id1677209917 for extra content every Wednesday 😈 SUPPORT...
