title,url,thumbnail_url,channel,views,uploaded_time,scraped_time,description
Mittens The Chess Bot Will Make You Quit Chess,https://www.youtube.com/watch?v=EYB7NOSY-hI,https://i.ytimg.com/vi/EYB7NOSY-hI/hqdefault.jpg?sqp=-oaymwEcCPYBEIoBSFXyq4qpAw4IARUAAIhCGAFwAcABBg==&rs=AOn4CLC_gEhzXwcfTC3zPIkvEsaFiomODQ,GMHikaru,960K,18 hours ago,05/01/2023,Hikaru plays against the 1 elo rated Mittens chess bot. ♟️ LEARN CHESS & PLAY WITH ME ► https://go.chess.com/hikaru 🎁 GIVE 💎 CHESS ► https://www.chess.com/membership/gift?ref_id=1...
Apex Legends Spellbound Collection Event,https://www.youtube.com/watch?v=IFrrZ3j8hw4,,Apex Legends,502K,14 hours ago,05/01/2023,"Enchant your opponents in the Spellbound Collection Event. Limited-time mode Control returns to the Apex Games: drop into 9 vs. 9 battles and team up to capture control points on the map, with..."
Salernitana vs. AC Milan: Extended Highlights | Serie A | CBS Sports Golazo,https://www.youtube.com/watch?v=XKD143OSAfo,,CBS Sports Golazo,108K,16 hours ago,05/01/2023,"Salernitana have been way more competitive than last season, but they ended 2022 with two defeats. AC Milan lost just once in their previous eight tilts. Stream Serie A and more Italian club..."
I Built a GIANT LEGO Castle For My Cats!,https://www.youtube.com/watch?v=KQqMUjMlKGo,,Half-Asleep Chris,346K,12 hours ago,05/01/2023,RALPH & BELLA PLUSHIES: https://www.makeship.com/shop/creator/half-asleep-chris I Built a GIANT LEGO Castle For My Cats! I combined 10 of the LEGO Lion Knight's Castle with a ton of extra...
Bills safety Damar Hamlin taken to hospital after Monday Night Football injury,https://www.youtube.com/watch?v=PR715VHT8LE,,WTVR CBS 6,1.3M,2 days ago,05/01/2023,A Bills player was taken off the field in an ambulance during a Monday Night Football matchup with the Cincinnati Bengals.
Bills' Damar Hamlin in critical condition after suffering cardiac arrest | NFL | FIRST THINGS FIRST,https://www.youtube.com/watch?v=Wf1e4kPAwBU,,First Things First,498K,1 day ago,05/01/2023,Last night’s Buffalo Bills-Cincinnati Bengals came to an abrupt halt when Bills safety Damar Hamlin collapsed on the field. Hamlin suffered cardiac arrest and was given CPR on the field to...
playing every single frogger game just to feel something,https://www.youtube.com/watch?v=FCnjMWhCOcA,,Noodle,288K,15 hours ago,05/01/2023,Get PayPal Honey for FREE today ▸ https://joinhoney.com/noodle Honey finds coupons with one click. Thanks to Honey for sponsoring! forger :( voices that aren't mine: Mothballs VA: https://www...
"B. Simone & Megan Ashley Talk Stealing From Walmart, Relationships, Deion Sanders, Dating Marco",https://www.youtube.com/watch?v=lKp-fqe3Y3Q,,Breakbeat Media,334K,1 day ago,05/01/2023,"B. Simone is an American actress, comedian, beautician, rapper, singer, and internet personality. She is best known for being one of the recurring cast members on the improv comedy show Wild..."
"Skrillex, Fred again.. & Flowdan - Rumble [Official Audio]",https://www.youtube.com/watch?v=7z25ZZ3DHds,,Skrillex,220K,12 hours ago,05/01/2023,"Skrillex, Fred again.. & Flowdan - Rumble [Official Audio] Stream/DL: https://skrillex.lnk.to/RumbleID Subscribe for more official content from Skrillex: https://Skrillex.lnk.to/SkrillexSubscribe..."
"Cheap And Healthy Meals For The Week, Done In 1 Hour",https://www.youtube.com/watch?v=AYXfaVD5o40,,Joshua Weissman,516K,15 hours ago,05/01/2023,"I'm challenging myself to get shredded with meal prep... but it actually tastes good. Get My Cookbook: http://bit.ly/JWCookbookAmazon Additional Cookbook Options (other stores, international,..."
